text,will_creation,direction,bequest,nomination,sign_will,attestation,authorization,revocation,excuse
2. PAYMENT OF DEBTS: I direct that all my debts and funeral expenses be paid as soon as practical after my death.,0,1,0,0,0,0,0,0,0
"3. DISPOSITION OF TANGIBLE PERSONAL PROPERTY: I bequeath to [Person-6], if living at my death, all of my clothing and other tangible personal property, including cash on hand, owned by me at the time of my death. In the event of the death of [Person-6], I bequeath the same to his issue by the right of representation.",0,0,1,0,0,0,0,0,0
"4. RESIDUE: All of the rest, residue, and remainder of my estate, of whatsoever kind and nature and wheresoever situated, I bequeath and devise to [Person-6], and in the event that he shall predecease me, then to his issue by the right of representation.",0,0,1,0,0,0,0,0,0
"5. PERSONAL REPRESENTATIVE: I appoint [Person-6] to be my Personal Representative and in the event [Person-6] shall predecease me, fail to qualify or for any other reason not serve as Personal Representative, then I nominate and appoint [Person-8] as my Personal Representative.",0,0,0,1,0,0,0,0,0
I direct that my Personal Representative in the administration of my estate and the execution of this will shall not be required to post bond for the performance of the duties of the office.,0,1,0,0,0,0,0,0,1
I further give to my Personal Representative all of the powers of a Personal Representative under the laws of the state of Idaho as now in effect and as may hereafter be amended.,0,0,0,0,0,0,1,0,0
"6. NO CONTEST: If any legatee, devisee, or taker under this will shall interpose objections to its probate or in any other way contest it, such person shall forfeit his entire interest under this will and the gift, bequest or devise made to such person shall pass as part of the residue of my estate, provided, however, that if such person is a residuary beneficiary, his or her interest shall be divided proportionately among the remaining residuary beneficiaries.",0,1,1,0,0,0,0,0,0
"I recognize that the present statutes place certain limitations on this provision and therefore in the event the court and the law in effect at the time prohibits such forfeiture, then in such event to such contesting party I give the sum of Ten Dollars ($10.00) in lieu of any other provision made for him or her under this will so that there will not be an absolute forfeiture but will be the benefit going to that person or those persons so contesting.",0,0,1,0,0,0,0,0,0
"IN WITNESS WHEREOF, I, [Person-1], having hereunto set my hand and seal at the City of Burley, County of cassia, state of Idaho, do hereby publish and declare this to be my Last Will and Testament, this 20 day of October, 1987.",1,0,0,0,1,0,0,0,0
"The foregoing instrument, consisting of four pages, including the page signed by the undersigned witnesses, was, on the date thereof signed, published and declared by the above-named [Person-1] to be her Last Will and Testament, in the presence of us, who, at her request and in her presence and in the presence of each other, and on the same date, have subscribed our names as witnesses thereto.",1,0,0,0,1,0,0,0,0
"STATE OF IDAHO County of Cassia ss We, [Person-1], the Testatrix, and [Person-9], [Person-10] and [Person-11], the witnesses, respectively, whose names are signed to the attached or foregoing instrument, being first duly sworn, do hereby declare to the undersigned authority that the Testatrix signed and executed the instrument as her Last Will and Testament and that she had signed willingly, and that she executed it as her free and voluntary act for the purposes therein expresed; and that each of the witnesses, in the presence and hearing of the Testatrix, signed the will as witness and that to the best of his knowledge the Testatrix was at the time an adult, of sound mind and under no constraint or undue influence.",1,0,0,0,1,1,0,0,0
"SUBSCRIBED, SWORN TO, AND ACKNOWLEDGED before me, by [Person-1], the Testatrix, and [Person-9], [Person-10], and [Person-11], the witnesses this 20th day of October, 1987.",0,0,0,0,1,1,0,0,0
"I, [Person-1], of Burley, County of Twin Falls, State of Idaho, being of lawful age of 71 years and of sound and disposing mind and memory and not acting under duress, menace or undue influence of any person or persons whomsoever, do hereby make, publish and declare this to be My Last Will and Testament, hereby revoking all other and former wills and testamentary papers of any kind heretofore made by me, and I dispose of my property in the following manner, to wit:",1,0,0,0,0,0,0,1,0
"SECOND: I direct my personal representative hereinafter named to have my body cremated and the ashes buried next to and in the same cemetery where the ashes of my dear departed first husband are buried at the [Location-1] in Buhl, Idaho.",0,1,0,0,0,0,0,0,0
"FOURTH: I have previously entered into a Revocable Trust Agreement (Inter Vivos Trust) with [Organization-1] at Twin Falls, Idaho. It is intended that almost all of my property will be controlled by that instrument and this Will shall simply operate to dispose of those few items not in the trust and otherwise to pour the rest, residue and remainder of my estate over into the Trust.",0,0,0,0,0,0,0,0,0
FIFTH: I direct that all of my just debts including charitable pledges whether or not the same are enforceable obligations of my estate and funeral expenses be paid as soon as practicable after my death.,0,1,0,0,0,0,0,0,0
SIXTH: It is my intention to make a separate written instrument leaving items of tangible personal property to various people as allowed by Section 15-2-513 of the Idaho Code. If I leave no such separate written instrument then said property shall pass as it would under my Will without such instrument.,1,0,1,0,0,0,0,0,0
SEVENTH: I have purposely omitted my adopted son [Person-3] and my adopted daughter [Person-4] from this Will. I hereby intentionally disinherit each of them and leave nothing to either of them.,0,0,0,0,0,0,0,0,0
"EIGHTH: I hereby give, devise and bequeath all of the rest, residue and remainder of my estate to the [Organization-1] as trustee under the Revocable Trust Agreement and as thereafter amended to be distributed and disposed of pursuant to the terms of said Revocable Trust Agreement and any amendments thereto.",0,0,1,0,0,0,0,0,0
"NINTH: I hereby nominate and appoint the [Organization-1] as personal representative of this my Last Will and Testament, and direct that it shall not be required to give bond as such personal representative.",0,1,0,1,0,0,0,0,1
I further provide that the person named above shall not be required to furnish bond or bonds in such capacity.,0,1,0,0,0,0,0,0,1
I further provide that the person named as personal representative serve in this capacity without intervention of the Court and that such personal representative shall have the authority and power to sell at public or private sale as said personal representative deems appropriate any real or personal property of which I may die possessed.,0,1,0,0,0,0,1,0,1
"I further direct that such sale may be made without notice to the Court or application thereto and that the personal representative may employ real estate brokers for the purpose of assisting with the sale of said property and agree to pay the customary commission for such sale and that this, in turn, may be done without notice or application to the Court.",0,1,0,0,0,0,1,0,1
It is intended that this be a nonintervention Will.,0,0,0,0,0,0,0,0,0
"IN WITNESS WHEREOF, I, [Person-1], the testatrix, sign my name to this instrument this 25th day of July, 1989, and being first duly sworn, do hereby declare to the undersigned authority that I sign and execute this instrument as my last Will and that I sign it willingly, that I execute it as my free and voluntary act for the purposes therein expressed, and that I am eighteen years of age or older, of sound mind, and under no constraint or undue influence.",1,0,0,0,1,1,0,0,0
"We, [Person-5] and [Person-6], the witnesses, sign our names to this instrument, consisting of four pages, and being first duly sworn do hereby declare to the undersigned authority that the testatrix signs and executes this instrument as her last Will and that she signs it willingly, and that each of us, in the presence and hearing of the testatrix, hereby signs this Will as witness to the testatrix's signing, and that to the best of our knowledge the testatrix is eighteen (18) years of age or older, of sound mind, and under no constraint of undue influence.",1,0,0,0,1,1,0,0,0
"STATE OF IDAHO County of Cassia ss Subscribed, sworn to and acknowledged before me by [Person-1], the testatrix, and subject and sworn to me by [Person-5] and [Person-6], the witnesses, this 25th day of July, 1989.",0,0,0,0,1,1,0,0,0