text,will_creation,direction,bequest,nomination,sign_will,attestation,authorization,revocation,excuse
"I, [Person-1] of the [Address-1], County of Cassia and State of Idaho, of the age of 72 years, being of sound mind and memory, and not acting under duress, menace, fraud or undue influence of any person whomsoever, do make, publish, and declare this my Last Will and Testament in manner and form following, to-wit: ",1,0,0,0,0,0,0,0,0
"FIRST, It is my will, and I do order, that all by just debts and funeral expenses be duly paid and satisfied as soon as conveniently can be done after my decease. ",0,1,0,0,0,0,0,0,0
"SECOND, I give, devise and bequeath unto my spouse, [Person-2] all real property, together with all the rest, residue, and remainder of my estate, real, personal and mixed, of every kind and nature and wheresoever situated, of which I now owned, possessed, including all other community personal property that may hereafter be acquired, or to which I may be entitled at the time of my decease.",0,0,1,0,0,0,0,0,0
"THIRD, I nominate, constitute and appoint [Person-3], to be the executor of this, my Last Will. ",0,0,0,1,0,0,0,0,0
IN WITNESS WHEREOF I have hereunto set my hand this day of 1987.,0,0,0,0,1,0,0,0,0
"The foregoing instrument, was this 2nd day of December, 1987 subscribed by the testator in our presence and was at the same time declared by him to be his Last Will and Testament, and we at the same time, in his presence, at his request and in the presence of each other have hereunto subscribed our names as attesting witnesses. And we do hereby certify that at the time of the execution of said Will the said testator, [Person-1] was of sound and disposing mind, memory and understanding. ",1,0,0,0,1,1,0,0,0
"I, [Person-1] of the county of Minidoka, state of Idaho, being of legal age and of sound and disposing mind and memory, and not acting under duress, menace, or undue influence of any person or persons whomsoever, do hereby make, publish and declare this to be my LAST WILL. AND TESTAMENT' hereby revoking all other and former wills and testamentary papers of any kind heretofore made by me, and dispose of my property in the following manner, to wit:",1,0,0,0,0,0,0,1,0
"FIRST: I direct that my personal representative, as soon as sufficient funds are on hand, pay the expenses of my last illness and funeral, together with all of my just debts.",0,1,0,0,0,0,0,0,0
"THIRD: It is my intention to make a separate written instrument, leaving items of tangible personal property to various people, as allowed by §15-2-513 of the Idaho Code. If I leave no such separate written instrument, then said property shall pass as it would under my Will without such instrument.",1,0,1,0,0,0,0,0,0
"FOURTH: I give, devise and bequeath all of the property of which I die possessed, including real, personal or mixed property of whatever nature or kind, to my children, [Person-2], [Person-3], [Person-4], and [Person-5], in equal shares, share and share alike, the children of a deceased child of mine to take the parent's share in equal shares.",0,0,1,0,0,0,0,0,0
"FIFTH: I direct that all estate, inheritance, transfer, legacy, succession, and other death taxes and duties of any nature by reason of my death which may be assessed or imposed upon or with respect to property passing under this Will shall be paid out of my estate as an expense of administration and no part of said taxes shall be apportioned or prorated to any legatee or devisee under this Will or any person owning or receiving any property, including life insurance not passing under this Will.",0,1,0,0,0,0,0,0,0
"SIXTH: I hereby nominate and appoint my daughter, [Person-2], as personal representative of this, my LAST WILL and TESTAMENT, PROVIDED that in the event said daughter does not survive me or in the event such daughter is unable or unwilling to act, then I hereby nominate and appoint [Person-3] to serve as personal representative.",0,0,0,1,0,0,0,0,0
"SEVENTH: In the event any person claiming to be an heir contests this Will or any portion thereof, then he is to receive the sum of One Dollar ($1. 00) and no more.",0,0,1,0,0,0,0,0,0
"IN WITNESS WHEREOF I, [Person-1], the testator sign my name to this instrument this 8th day of March, 1989, and being first duly sworn, do hereby declare to the undersigned authority that I sign and execute this instrument as my Last Will and that I sign it willingly, that I execute it as my free and voluntary act for the purposes therein expressed, and that I am 18 years of age or older, of sound mind, and under no constraint or undue influence. ",1,0,0,0,1,1,0,0,0
"We [Person-6] and [Person-7] the witnesses, sign our names to this instrument, being first duly sworn, and do hereby declare to the undersigned authority that the Testator signs and executes this instrument as his last will and that he signs it willingly and that each of us, in the presence and hearing of the Testator hereby signs this will as witness to the Testator's signing, and that to the best of his knowledge the Testator is eighteen (18) years of age or older, of sound mind, and under no constraint or undue influence.",1,0,0,0,1,1,0,0,0
"I, [Person-1], over the age of eighteen (18) years, a citizen of the State of Idaho and a resident of the County of Cassia, State of Idaho, being of sound and disposing mind and not under restraint or undue influence, do make, publish and declare this to be my Last Will and Testament, hereby revoking all other Wills by me made.",1,0,0,0,0,0,0,1,0
"FIRST: I declare that my estate whereof I may die possessed is community property of my spouse, [Person-2], and myself.",0,0,0,0,0,0,0,0,0
SECOND: It is my will that my debts and the charges of my funeral be paid as soon as conveniently may be after my death.,0,1,0,0,0,0,0,0,0
"THIRD: I give and devise all of my estate, both separate and community, both real and personal, in the following manner: I hereby give, devise and bequeath unto my beloved spouse, [Person-2], all of my estate, real, personal and mixed, of every nature, kind and description, wherever situated and however held, which is or may be subject to my testamentary disposition at the time of my death. ",0,0,1,0,0,0,0,0,0
"FOURTH: In the event of the demise of my beloved spouse, [Person-2], before my death, I give, devise and bequeath 10% of my net estate to the [Organization-1], Idaho, and all the residue of my estate, both real and personal of whatever kind the same may be and wherever situated of which I may die possessed, or to which I may be entitled, to [Person-3], [Person-4], [Person-5] and [Person-6] in equal shares, share and share alike.",0,0,1,0,0,0,0,0,0
"In the event of the death of [Person-3], [Person-4], [Person-5] or [Person-6] without issue, prior to my death, I direct the share to which said beneficiary would be entitled had said beneficiary survived me be distributed in equal shares, share and share alike, to the remaining survivors of [Person-3], [Person-4], [Person-5] or [Person-6].",0,1,1,0,0,0,0,0,0
"FIFTH: Having in mind at the time of making this my Last Will and Testament and any codicils thereto all my other relatives and their children and any other persons not herein named or in any codicils hereto, I declare that my failure to provide for them in this my Last Will and Testament is intentional and not accidental.",0,0,0,0,0,0,0,0,0
I further direct that if any beneficiary under this Will should contest the terms of this Will they shall receive nothing by the terms of this Will and that share which they would have received shall be divided among the remaining beneficiaries of my estate in the same manner as though they had predeceased me without issue.,0,1,1,0,0,0,0,0,0
"SIXTH: I hereby nominate, constitute and appoint my beloved spouse, [Person-2], to serve as Personal Representative without bond of this my Last Will and Testament and in the event my spouse is not living at the time of my death or declines to act or is disabled from acting, I hereby nominate, constitute and appoint [Person-4], to serve as Personal Representative, without bond, in place of my spouse.",0,0,0,1,0,0,0,0,1
"In the event neither of the above-named Personal Representatives shall be living or in the event they shall decline to act then, in that event, I nominate, constitute and appoint [Person-3] as Personal Representative without bond in their place.",0,0,0,1,0,0,0,0,1
"IN WITNESS WHEREOF, I, [Person-1], the Testator, sign my name to this instrument this 24th day of January, 1989, and being first duly sworn, do hereby declare to the undersigned authority that I sign and execute this instrument as my Last Will and that I sign it willingly, that I execute it as my free and voluntary act for the purposes therein expressed, and that I am eighteen (18) years of age or older, of sound mind, and under no constraint or undue influence.",1,0,0,0,1,1,0,0,0
"We, [Person-6] and [Person-7] the witnesses, sign our names to this instrument, being first duly sworn, and do hereby declare to the undersigned authority that the Testator signs and executes this instrument as his Last Will and that he signs it willingly and that each of us, in the presence and hearing of the Testator hereby signs this Will as witness to the Testator signing, and that to the best of our knowledge the Testator is eighteen (18) years of age or older, of sound mind, and under no constraint or undue influence.",1,0,0,0,1,1,0,0,0
"I, [Person-1], over the age of eighteen (18) years, a citizen of the State of Idaho and a resident of the City of Burley, Cassia County, State of Idaho, being of sound and disposing mind and not under restraint or undue influence, do make, publish and declare this to be my Last Will and Testament, hereby revoking all other Wills by me made.",1,0,0,0,0,0,0,1,0
FIRST: I declare that my estate whereof I may die possessed is my sole and separate property and I am a widower.,0,0,0,0,0,0,0,0,0
"THIRD: I give and devise all of my estate, both separate and community, both real and personal, to [Person-2], if he survives me.",0,0,1,0,0,0,0,0,0
"FOURTH: In the event of the demise of [Person-2] before my death, I give, devise and bequeath all the residue of my estate, both real and personal of whatever kind the same may be and wherever situated of which I may die possessed, or to which I may be entitled, to my stepchildren, to-wit: [Person-3], [Person-4] and [Person-5] in equal shares, share and share alike. In the event of the death of any of my stepchildren without issue prior to my death, I direct the share to which said beneficiary would be entitled, had said beneficiary survived me, be distributed in equal shares, share and share alike, to my remaining surviving stepchildren; but if they leave children then their share shall go to their children by right of representation. ",0,1,1,0,0,0,0,0,0
"FIFTH: I hereby nominate, constitute and appoint [Person-2] to serve as Personal Representative without bond of this my Last Will and Testament and in the event he is not living at the time of my death, or declines to act or is disabled from acting, I hereby nominate, constitute and appoint [Person-3] to serve as Personal Representative, without bond, in place of [Person-2]",0,0,0,1,0,0,0,0,1
SIXTH: I have omitted from the provisions of this Will my brothers and any other persons who are or who may claim to be my heirs and such omission is intentional and not accidental.,0,0,0,0,0,0,0,0,0
"IN WITNESS WHEREOF, I, [Person-1], the Testator, sign my name to this instrument this 8-26-88 day of August, 1988, and being first duly sworn, do hereby declare to the undersigned authority that I sign and execute this instrument as my Last Will and that I sign it willingly, that I execute it as my free and voluntary act for the purposes therein expressed, and that I am eighteen (18) years of age or older, of sound mind, and under no constraint or undue influence.",1,0,0,0,1,1,0,0,0
"We, [Person-4] and [Person-5], the witnesses, sign our names to this instrument, being first duly sworn, and do hereby declare to the undersigned authority that the Testator signs and executes this instrument as his Last Will and Testament and that he signs it willingly and that each of us, in the presence and hearing of the Testator hereby signs this Will as witness to the Testator signing, and that to the best of our knowledge the Testator is eighteen (18) years of age or older, of sound mind, and under no constraint or undue influence.",1,0,0,0,1,1,0,0,0
"I, [Person-1] over the age of eighteen (18) years, a citizen  of the State of Idaho and a resident of the City of Burley, Cassia County, State of Idaho, being of sound and disposing mind and not under restraint or undue influence, do make, publish and declare this to be my Last Will and Testament, hereby revoking all other Wills by me made.",1,0,0,0,0,0,0,1,0
"THIRD: I give and devise all of my estate, both separate and community, both real and personal, in the following manner: I hereby give, devise and bequeath unto my beloved spouse, [Person-2], all of my estate, real, personal and mixed, of every nature, kind and description, wherever situated and however held, which is or may be subject to my testamentary disposition at the time of my death, except my undivided one-half (½) interest in [Location-1] which I give, devise and bequeath unto [Person-3] in satisfaction of money owed to him.",0,0,1,0,0,0,0,0,0
"In the event [Person-3] should predecease me, then I give, devise and bequeath my undivided one-half (½) interest in [Location-1] to my husband, [Person-2]. In the event [Person-2] should predecease me, I give, devise and bequeath all my property to [Person-3].",0,0,1,0,0,0,0,0,0
"FOURTH: In the event of the demise of my beloved spouse, [Person-2], and [Person-3], before my death, I give, devise and bequeath all my estate, both real and personal of whatever kind the same may be and wherever situated of which I may die possessed, or to which I may be entitled, to my children, [Person-4], [Person-5], and [Person-6] in equal shares, share and share alike. In the event of the death of any of my children without issue, prior to my death, I direct the share to which said beneficiary would be entitled had said beneficiary survived me be distributed in equal shares, share and share alike, to my remaining surviving children. ",0,1,1,0,0,0,0,0,0
"FIFTH: I hereby nominate, constitute and appoint my beloved spouse, [Person-2], to serve as Personal Representative without bond of this my Last Will and Testament and in the event my spouse is not living at the time of my death or declines to act or is disabled from acting, I hereby nominate, constitute and appoint [Person-3] to serve as Personal Representative, without bond, in place of my spouse.",0,0,0,1,0,0,0,0,0
"IN WITNESS WHEREOF, I, [Person-1], the Testatrix, sign my name to this instrument this [Date-1], and being first duly sworn, do hereby declare to the undersigned authority that I sign and execute this instrument as my Last Will and that I sign it willingly, that I execute it as my free and voluntary act for the purposes therein expressed, and that I am eighteen (18) years of age or older, of sound mind, and under no constraint or undue influence.",1,0,0,0,1,1,0,0,0
"We, [Person-6] and [Person-7], the witnesses, sign our names to this instrument, being first duly sworn, and do hereby declare to the undersigned authority that the Testatrix signs and executes this instrument as her Last Will and that she signs it willingly and that each of us, in the presence and hearing of the Testatrix hereby signs this Will as witness to the Testatrix signing, and that to the best of our knowledge the Testatrix is eighteen (18) years of age or older, of sound mind, and under no constraint or undue influence.",1,0,0,0,1,1,0,0,0
"KNOW ALL MEN BY THESE PRESENTS, That I, [Person-1], of Burley, Cassia County, State of Idaho, being over the age of 18 years and of sound and disposing mind and memory, and not acting under duress, menace, fraud or the undue influence of any person whomsoever, and being mindful of the uncertainties of life, do make, publish and declare this to be my Last Will and Testament in the manner following, that is to say:",1,0,0,0,0,0,0,0,0
"FIRST: I declare that I am married. That the name of my wife is [Person-2], and I do further declare that all of my property, both real and personal, of whatsoever kind and character and wheresoever found, is the community property of myself and my beloved wife, [Person-2].",0,0,0,0,0,0,0,0,0
"SECOND: I direct my Personal Representative, hereinafter named, so soon as she shall have sufficient funds in hand, to pay all my just debts, expenses of my last illness and funeral expenses.",0,1,0,0,0,0,0,0,0
"THIRD: I declare that at the date of execution hereof, I have the following named children, to-wit: [Person-3], [Person-4], [Person-5], [Person-6], [Person-7], and [Person-8].",0,0,0,0,0,0,0,0,0
"FOURTH: I do hereby devise and bequeath to my beloved wife, [Person-2], all and the whole of my estate, both real and personal and of whatsoever kind or character and wheresoever found, to have and hold forever.",0,0,1,0,0,0,0,0,0
"FIFTH: That in the event my beloved wife, [Person-2], should precede me in death or in the event of our simultaneous deaths, then and in that event I do hereby devise and bequeath to my beloved children, [Person-3], [Person-4], [Person-5], [Person-6], [Person-7], and [Person-8], all and the whole of my estate, both real and personal and of whatsoever kind or character and wheresoever found, to have and hold, share and share alike.",0,0,1,0,0,0,0,0,0
"SIXTH: Providing further that in the event either or any of my beloved children shall precede me in death, then and in that event, I do hereby devise and bequeath his or her share to the issue of his or her body, and in the event he or she shall leave no issue, then and in that event I do hereby devise and bequeath his or her share to the surviving sons and/or daughters, to have and hold equally, share and share alike.",0,0,1,0,0,0,0,0,0
"SEVENTH: I do hereby appoint my beloved wife, [Person-2], to act as Personal Representative of this, my Last Will and Testament, without bond.",0,0,0,1,0,0,0,0,1
"IN WITNESS WHEREOF, I hereunto set my hand and seal this 24th day of July, 1987.",0,0,0,0,1,0,0,0,0
"SELF-PROVED WILL STATE OF IDAHO, County of Minidoka. ss. We, [Person-1], [Person-9] and [Person-10], the testator and the witnesses, respectively, whose names are signed to the attached or foregoing instrument, being first duly sworn, do hereby declare to the undersigned authority that the testator signed and executed the instrument as his last Will and that he had signed willingly, and that he executed it as his free and voluntary act for the purposes therein expressed; and that each of the witnesses, in the presence and hearing of the testator, signed the Will as witness and that to the best of their knowledge the testator was at the time an adult, of sound mind and under no constraint or undue influence.",1,0,0,0,1,1,0,0,0
"SUBSCRIBED, sworn to and acknowledged before me by [Person-1], the testator, and subscribed and sworn to before me by [Person-9] and [Person-10], witnesses, this 24th day of July, 1987.",0,0,0,0,1,1,0,0,0
"I, [Person-1], a resident of Burley, Idaho, being of full legal age and sound and disposing mind and acting with freedom from fraud, duress or undue influence, do hereby make and declare this to be my Last Will and Testament.",1,0,0,0,0,0,0,0,0
I hereby revoke any will or codicil I may have previously made.,1,0,0,0,0,0,0,1,0
"I have an adopted son, [Person-3]. I have intentionally omitted to provide for the children of my son [Person-3], because his children have become estranged from him as a result of the divorce of their parents.",0,0,0,0,0,0,0,0,0
It is my intention to dispose of all of my separate and community property by this Will.,0,0,0,0,0,0,0,0,0
"SECOND: I hereby direct my personal representative to pay all of my just debts, including my funeral expenses and the expenses of my last illness as soon as conveniently possible after my death. I leave to the discretion of my personal representative to prepay any secured indebtedness which is payable in installments or to distribute the security subject to the indebtedness.",0,1,0,0,0,0,1,0,0
"THIRD: In the event I have prepared a list directing the disposition of certain items of personal property as authorized by Section 15-2-513 of the Idaho Code, I direct that said list shall govern the disposition of the specific items of personal property listed therein and shall take precedence over any inconsistent provisions of this Will.",0,1,0,0,0,0,0,0,0
"FOURTH: I give and bequeath all of my estate of every kind and nature whatsoever to my wife [Person-2] to be placed in trust for her use and benefit under the terms and conditions set forth below. If [Person-2] does not survive me, I give and bequeath all the rest, residue and remainder of my estate to [Person-3].",0,0,1,0,0,0,0,0,0
"If [Person-3] and [Person-2] both shall die before me, I give and bequeath all of the rest, residue and remainder of my estate to the [Organization-2] at Burley, Idaho.",0,0,1,0,0,0,0,0,0
"FIFTH: If my wife, [Person-2], is living at my death, I direct that all of the assets of my estate which may be distributed to her be placed in trust to be used for her support and care during her lifetime.",0,1,1,0,0,0,0,0,0
I direct the Trustee to sell all real and personal property which is distributed to the trust and invest the proceeds in United States government securities or certificates of deposit insured by the Federal Deposit Insurance Corporation.,0,1,0,0,0,0,0,0,0
"The Trustee is directed to pay all of the net income from the trust each year for the use and benefit of my wife, [Person-2].",0,1,0,0,0,0,0,0,0
"If the trust income is not sufficient to meet the reasonable living expenses of [Person-2] during her lifetime, taking into account her needs and other resources, I direct that the Trustee shall have the right to invade the principal of the trust to expend for the use and benefit of [Person-2].",0,1,0,0,0,0,1,0,0
"Upon the death of [Person-2], the trust shall cease and the Trustee shall distribute the same to my son, [Person-3].",0,0,1,0,0,0,0,0,0
"In the event [Person-3] shall have died before my wife, [Person-2], I direct that the Trustee shall distribute the net trust estate, after the death of [Person-2] to [Organization-2] at Burley, Idaho.",0,1,1,0,0,0,0,0,0
"The Trustee shall have all of the powers of a Trustee under the Uniform Trustee's Powers Act of the State of Idaho including any amendments thereto, and all principal and interest shall be accounted for according to the Uniform Principal and Income Act of the State of Idaho.",0,0,0,0,0,0,1,0,0
"I hereby nominate [Person-4] of Burley, Idaho as Trustee of said trust.",0,0,0,1,0,0,0,0,0
If he declines or is unable to act I nominate my son [Person-3] as First Alternative Trustee.,0,0,0,1,0,0,0,0,0
"If he also declines or is unable to act, I nominate the [Organization-3] as the Trustee.",0,0,0,1,0,0,0,0,0
"I authorize the Trustee to receive reasonable compensation for administration of the trust and, I authorize the Trustee to employ accountants and attorneys to assist the Trustee in administration of the trust in preparation of any applicable tax returns.",0,0,0,0,0,0,1,0,0
SIXTH: I nominate and appoint [Person-4] as Personal Representative of my estate.,0,0,0,1,0,0,0,0,0
"If he should die before me or fail to qualify or act, I nominate [Person-3] as Alternate Personal Representative each to serve without bond.",0,0,0,1,0,0,0,0,1
"In the event both of them shall die before me or decline or fail to act, I nominate the [Organization-3].",0,0,0,1,0,0,0,0,0
"IN WITNESS WHEREOF, I [Person-1], having hereunto set my hand and seal at the City of Burley, County of Cassia, State of Idaho, do hereby publish and declare this to be my Last Will and Testament, this 4th day of January, 1989.",1,0,0,0,1,0,0,0,0
"The foregoing instrument, consisting of four (4) pages, including the page signed by the undersigned witnesses, was, on the thereof signed, published and declared by the above-named [Person-1], to be his Last Will and Testament, in the presence of us, who, at his request and in his presence and in the presence of each other, and on the same date, have subscribed our names as witnesses thereto.",1,0,0,0,1,0,0,0,0
"We, [Person-1], the Testator, and [Person-5] and [Person-6], the witnesses, respectively, whose names are signed to the attached or foregoing instrument, being first duly sworn, do hereby declare to the undersigned authority that the Testator signed and executed the instrument as his Last Will and Testament and that he had signed willingly, and that he executed it as his free and voluntary act for the purposes therein expressed; and that each of the witnesses, in the presence and hearing of the Testator, signed the will as witnesses and that to the best of his knowledge the Testator was at the time an adult, of sound mind and under no constraint or undue influence.",1,0,0,0,1,1,0,0,0
"SUBSCRIBED AND SWORN to before me by [Person-1], the Testator, and [Person-5] and [Person-6], the witnesses, this 4th day of January 1989.",0,0,0,0,1,1,0,0,0
"I, [Person-1], a legal resident of Burley, Idaho, being of sound mind, do make publish and declare this to be my Last Will and Testament, hereby revoking all wills and codicils heretofore made by me.",1,0,0,0,0,0,0,1,0
"1.2. I intend only to make provision for [Person-6]. I intend to omit from the benefits of this will [Person-3], [Person-4], and [Person-7] and any other person or persons whether related to me or not.",0,0,0,0,0,0,0,0,0
